{
  "artifact_type": "run-provenance",
  "schema_version": "1.0.0",
  "run": {
    "id": "cartpole-proof-20260711t120000z-a1b2c3d4e5f6",
    "uuid": "018f1a56-3779-7701-93ef-fa1398226d17",
    "created_at": "2026-07-11T12:00:00Z",
    "directory": "runs/cartpole-dqn/cartpole-proof-20260711t120000z-a1b2c3d4e5f6",
    "collision_policy": "reject-existing",
    "prior_run_uuid": null
  },
  "environment": {
    "registry_id": "CartPole-v1",
    "name": "CartPole",
    "version": "v1",
    "variant": null,
    "parameters": {
      "max_episode_steps": 500
    }
  },
  "algorithm": {
    "id": "dqn",
    "family": "dqn",
    "implementation": "bevy_gym::training::dqn",
    "version": "1",
    "parameters": {
      "gamma": 0.99
    }
  },
  "source": {
    "repository": "https://gitlab.example/bevy-gym.git",
    "git_commit": "1111111111111111111111111111111111111111",
    "dirty": false,
    "dirty_diff_sha256": null
  },
  "oracle": {
    "name": "Gymnasium",
    "version": "1.3.x",
    "git_commit": "7a1191388aa4aa973d3a5e4b039899cd99cc991f",
    "source_path": "ref/gymnasium"
  },
  "invocation": {
    "argv": [
      "cargo",
      "run",
      "--release",
      "--example",
      "cartpole",
      "--",
      "train",
      "--preset",
      "proof"
    ],
    "rendered": "cargo run --release --example cartpole -- train --preset proof",
    "working_directory": "/workspace/bevy-gym"
  },
  "runtime": {
    "crate_version": "0.3.3",
    "rustc_version": "rustc 1.88.0",
    "bevy_version": "0.18.0",
    "burn_version": "0.21.0",
    "target_triple": "x86_64-unknown-linux-gnu",
    "training_backend": "Autodiff<Flex>",
    "inference_backend": "Flex",
    "device": "cpu"
  },
  "host": {
    "operating_system": "Linux",
    "architecture": "x86_64",
    "cpu_count": 16
  },
  "timing": {
    "started_at": "2026-07-11T12:00:00Z",
    "finished_at": "2026-07-11T12:40:00Z",
    "elapsed_seconds": 2400
  },
  "counts": {
    "environment_steps": 80000,
    "episodes": 710,
    "optimizer_updates": 79000,
    "q_table_updates": 0
  },
  "stop_reason": {
    "code": "threshold-reached",
    "detail": "Fixed validation mean return reached 500."
  },
  "inputs": {
    "config": {
      "path": "config.json",
      "sha256": "2222222222222222222222222222222222222222222222222222222222222222",
      "byte_length": 2048
    },
    "seeds": {
      "path": "seeds.json",
      "sha256": "3333333333333333333333333333333333333333333333333333333333333333",
      "byte_length": 1536
    }
  },
  "best_checkpoint": {
    "path": "best.mpk",
    "sha256": "eeeeeeeeeeeeeeeeeeeeeeeeeeeeeeeeeeeeeeeeeeeeeeeeeeeeeeeeeeeeeeee",
    "byte_length": 19004,
    "kind": "best",
    "global_step": 60000,
    "episode_count": 520,
    "update_count": 59000
  },
  "reproducibility": {
    "all_recorded_seeds_applied": true,
    "same_seed_replay_checked": true,
    "same_seed_checkpoint_sha256": "eeeeeeeeeeeeeeeeeeeeeeeeeeeeeeeeeeeeeeeeeeeeeeeeeeeeeeeeeeeeeeee",
    "backend_determinism_notes": "The fixed CPU backend reproduced the checkpoint hash in the declared environment."
  }
}
